{
  "$schema": "https://json-schema.org/draft/2020-12/schema",
  "$id": "https://github.com/klmtseng/validity-audit/schemas/reviewer_output.schema.json",
  "title": "Validity Audit reviewer output",
  "description": "Provider-neutral findings imported by the v0.3 finalize stage. Policy outputs are deliberately absent.",
  "type": "object",
  "additionalProperties": false,
  "required": [
    "schema_version",
    "review_context",
    "reviewer",
    "operator_id",
    "claim_results",
    "findings",
    "summary"
  ],
  "properties": {
    "$schema": {
      "type": "string",
      "format": "uri-reference"
    },
    "schema_version": {
      "enum": ["0.3.0", "0.7.0"]
    },
    "review_context": {
      "enum": [
        "cold",
        "primed"
      ]
    },
    "reviewer": {
      "$ref": "#/$defs/reviewer"
    },
    "operator_id": {
      "type": "string",
      "minLength": 1,
      "maxLength": 255
    },
    "priming_sources": {
      "type": "array",
      "minItems": 1,
      "uniqueItems": true,
      "items": {
        "type": "string",
        "minLength": 1,
        "maxLength": 2000
      }
    },
    "claim_results": {
      "type": "array",
      "minItems": 1,
      "uniqueItems": true,
      "items": {
        "$ref": "#/$defs/claimResult"
      }
    },
    "findings": {
      "type": "array",
      "uniqueItems": true,
      "items": {
        "$ref": "#/$defs/finding"
      }
    },
    "waivers": {
      "type": "array",
      "uniqueItems": true,
      "items": {
        "$ref": "#/$defs/waiverRequest"
      }
    },
    "summary": {
      "type": "string",
      "minLength": 1,
      "maxLength": 4000
    }
  },
  "allOf": [
    {
      "if": {
        "properties": {
          "review_context": {
            "const": "primed"
          }
        },
        "required": [
          "review_context"
        ]
      },
      "then": {
        "required": [
          "priming_sources"
        ]
      },
      "else": {
        "not": {
          "required": [
            "priming_sources"
          ]
        }
      }
    },
    {
      "if": {
        "properties": {
          "schema_version": {
            "const": "0.3.0"
          }
        },
        "required": [
          "schema_version"
        ]
      },
      "then": {
        "properties": {
          "claim_results": {
            "items": {
              "properties": {
                "evidence": {
                  "items": {
                    "$ref": "#/$defs/legacyEvidence"
                  }
                }
              }
            }
          },
          "findings": {
            "items": {
              "properties": {
                "assertion": false,
                "evidence": {
                  "items": {
                    "$ref": "#/$defs/legacyEvidence"
                  }
                }
              }
            }
          }
        }
      }
    }
  ],
  "$defs": {
    "legacyEvidence": {
      "description": "Schema 0.3.0 evidence may not carry the 0.7.0 claim-binding or coverage fields.",
      "properties": {
        "covers_claim_ids": false,
        "coverage": false
      }
    },
    "identifier": {
      "type": "string",
      "minLength": 1,
      "maxLength": 128,
      "pattern": "^[A-Za-z0-9][A-Za-z0-9._:-]*$"
    },
    "slug": {
      "type": "string",
      "minLength": 1,
      "maxLength": 64,
      "pattern": "^[a-z][a-z0-9._-]*$"
    },
    "sha256": {
      "type": "string",
      "pattern": "^[a-f0-9]{64}$"
    },
    "reviewer": {
      "type": "object",
      "additionalProperties": false,
      "required": [
        "kind",
        "label"
      ],
      "properties": {
        "kind": {
          "enum": [
            "human",
            "model",
            "hybrid"
          ]
        },
        "label": {
          "type": "string",
          "minLength": 1,
          "maxLength": 255
        }
      }
    },
    "evidence": {
      "type": "object",
      "additionalProperties": false,
      "required": [
        "evidence_id",
        "kind",
        "description"
      ],
      "properties": {
        "evidence_id": {
          "$ref": "#/$defs/identifier"
        },
        "kind": {
          "enum": [
            "command",
            "file_line",
            "digest",
            "note"
          ]
        },
        "description": {
          "type": "string",
          "minLength": 1,
          "maxLength": 4000
        },
        "locator": {
          "type": "string",
          "minLength": 1,
          "maxLength": 4000
        },
        "sha256": {
          "$ref": "#/$defs/sha256"
        },
        "covers_claim_ids": {
          "description": "Schema 0.7.0+. The contract claim ids this evidence item covers. Under a 0.7.0 reviewer output, evidence inside a claim result counts toward that claim only when it names the claim here.",
          "type": "array",
          "minItems": 1,
          "uniqueItems": true,
          "items": {
            "$ref": "#/$defs/identifier"
          }
        },
        "coverage": {
          "$ref": "#/$defs/coverage"
        }
      }
    },
    "coverage": {
      "description": "Schema 0.7.0+. Search-coverage proof for an absence (universal-negative) conclusion. It supports absence only when status is complete, truncated is false, and omitted_count is 0.",
      "type": "object",
      "additionalProperties": false,
      "required": [
        "scope",
        "status",
        "truncated",
        "omitted_count"
      ],
      "properties": {
        "scope": {
          "description": "The searched universe, stated concretely (paths, patterns, query, corpus).",
          "type": "string",
          "minLength": 1,
          "maxLength": 4000,
          "pattern": "\\S"
        },
        "status": {
          "enum": [
            "complete",
            "partial",
            "unknown"
          ]
        },
        "truncated": {
          "type": "boolean"
        },
        "omitted_count": {
          "type": "integer",
          "minimum": 0
        }
      }
    },
    "claimResult": {
      "type": "object",
      "additionalProperties": false,
      "required": [
        "claim_id",
        "outcome",
        "evidence",
        "finding_ids"
      ],
      "properties": {
        "claim_id": {
          "$ref": "#/$defs/identifier"
        },
        "outcome": {
          "enum": [
            "supported",
            "refuted",
            "inconclusive",
            "not_evaluated"
          ]
        },
        "evidence": {
          "type": "array",
          "uniqueItems": true,
          "items": {
            "$ref": "#/$defs/evidence"
          }
        },
        "finding_ids": {
          "type": "array",
          "uniqueItems": true,
          "items": {
            "$ref": "#/$defs/identifier"
          }
        },
        "rationale": {
          "type": "string",
          "minLength": 1,
          "maxLength": 4000
        }
      },
      "allOf": [
        {
          "if": {
            "properties": {
              "outcome": {
                "enum": [
                  "supported",
                  "refuted"
                ]
              }
            },
            "required": [
              "outcome"
            ]
          },
          "then": {
            "properties": {
              "evidence": {
                "minItems": 1
              }
            }
          },
          "else": {
            "required": [
              "rationale"
            ]
          }
        }
      ]
    },
    "finding": {
      "type": "object",
      "additionalProperties": false,
      "required": [
        "finding_id",
        "title",
        "description",
        "error_class",
        "severity",
        "confidence",
        "reproduction",
        "evidence"
      ],
      "properties": {
        "finding_id": {
          "$ref": "#/$defs/identifier"
        },
        "title": {
          "type": "string",
          "minLength": 1,
          "maxLength": 500,
          "pattern": "^[^\\n\\r\\u000b\\u000c\\u0085\\u2028\\u2029]*$"
        },
        "description": {
          "type": "string",
          "minLength": 1,
          "maxLength": 8000
        },
        "error_class": {
          "$ref": "#/$defs/slug"
        },
        "severity": {
          "enum": [
            "high",
            "med",
            "low"
          ]
        },
        "confidence": {
          "enum": [
            "high",
            "med",
            "low"
          ]
        },
        "reproduction": {
          "enum": [
            "reproduced",
            "unreproduced",
            "not_reproducible",
            "not_attempted"
          ]
        },
        "reproduction_notes": {
          "type": "string",
          "minLength": 1,
          "maxLength": 4000
        },
        "assertion": {
          "description": "Schema 0.7.0+. 'absence' marks a finding whose conclusion is that something does not exist (no source, no test, nothing found). Without a complete coverage proof in its evidence, the policy treats the finding as unreproduced.",
          "enum": [
            "absence"
          ]
        },
        "evidence": {
          "type": "array",
          "minItems": 1,
          "uniqueItems": true,
          "items": {
            "$ref": "#/$defs/evidence"
          }
        }
      },
      "allOf": [
        {
          "if": {
            "properties": {
              "reproduction": {
                "enum": [
                  "unreproduced",
                  "not_reproducible",
                  "not_attempted"
                ]
              }
            },
            "required": [
              "reproduction"
            ]
          },
          "then": {
            "required": [
              "reproduction_notes"
            ]
          }
        }
      ]
    },
    "waiverRequest": {
      "type": "object",
      "additionalProperties": false,
      "required": [
        "finding_id",
        "issuer",
        "reason",
        "issued_at",
        "expires_at"
      ],
      "properties": {
        "finding_id": {
          "$ref": "#/$defs/identifier"
        },
        "issuer": {
          "type": "string",
          "minLength": 1,
          "maxLength": 255
        },
        "reason": {
          "type": "string",
          "minLength": 1,
          "maxLength": 4000
        },
        "issued_at": {
          "type": "string",
          "format": "date-time"
        },
        "expires_at": {
          "type": "string",
          "format": "date-time"
        }
      }
    }
  }
}
